{"$schema":"https://json-schema.org/draft-07/schema#","description":"The published 256 unsigned (a,b) seed pairs + p for the frozen MinHashV2 scheme. Values exceed 2^53 so a/b/p are DECIMAL STRINGS for exactness.","properties":{"bands":{"type":"integer"},"count":{"type":"integer"},"p":{"type":"string"},"schema":{"type":"string"},"seedPairs":{"items":{"properties":{"a":{"type":"string"},"b":{"type":"string"}},"required":["a","b"],"type":"object"},"type":"array"},"shingleCodePoints":{"type":"integer"},"signatureBytes":{"type":"integer"},"valuesPerBand":{"type":"integer"}},"required":["schema","p","count","shingleCodePoints","signatureBytes","bands","valuesPerBand","seedPairs"],"title":"MinHashV2 frozen seed table","type":"object"}
